<?xml version="1.0"?>
<!DOCTYPE Notes SYSTEM "C://xampp/htdocs/GestionScolarite-XML/Validation_xml//notes.dtd">
<Notes>
  <Note>
    <CNE>17000011</CNE>
    <LastName>GIL3_LN1</LastName>
    <FirstName>GIL3_FN1</FirstName>
    <Matiere codeMatiere="GIL51">14</Matiere>
    <Matiere codeMatiere="GIL52">12</Matiere>
    <Matiere codeMatiere="GIL53">17</Matiere>
    <Matiere codeMatiere="GIL54">12</Matiere>
    <Matiere codeMatiere="GIL55">12</Matiere>
    <Matiere codeMatiere="GIL56">12</Matiere>
  </Note>
  <Note>
    <CNE>17000012</CNE>
    <LastName>GIL3_LN2</LastName>
    <FirstName>GIL3_FN2</FirstName>
    <Matiere codeMatiere="GIL51">13</Matiere>
    <Matiere codeMatiere="GIL52">14</Matiere>
    <Matiere codeMatiere="GIL53">12</Matiere>
    <Matiere codeMatiere="GIL54">13</Matiere>
    <Matiere codeMatiere="GIL55">15</Matiere>
    <Matiere codeMatiere="GIL56">15</Matiere>
  </Note>
  <Note>
    <CNE>17000013</CNE>
    <LastName>GIL3_LN3</LastName>
    <FirstName>GIL3_FN3</FirstName>
    <Matiere codeMatiere="GIL51">12</Matiere>
    <Matiere codeMatiere="GIL52">12</Matiere>
    <Matiere codeMatiere="GIL53">12</Matiere>
    <Matiere codeMatiere="GIL54">12</Matiere>
    <Matiere codeMatiere="GIL55">12</Matiere>
    <Matiere codeMatiere="GIL56">13</Matiere>
  </Note>
  <Note>
    <CNE>17000014</CNE>
    <LastName>GIL3_LN4</LastName>
    <FirstName>GIL3_FN4</FirstName>
    <Matiere codeMatiere="GIL51">19</Matiere>
    <Matiere codeMatiere="GIL52">16</Matiere>
    <Matiere codeMatiere="GIL53">12</Matiere>
    <Matiere codeMatiere="GIL54">12</Matiere>
    <Matiere codeMatiere="GIL55">17</Matiere>
    <Matiere codeMatiere="GIL56">19</Matiere>
  </Note>
  <Note>
    <CNE>17000015</CNE>
    <LastName>GIL3_LN5</LastName>
    <FirstName>GIL3_FN5</FirstName>
    <Matiere codeMatiere="GIL51">17</Matiere>
    <Matiere codeMatiere="GIL52">12</Matiere>
    <Matiere codeMatiere="GIL53">13</Matiere>
    <Matiere codeMatiere="GIL54">10</Matiere>
    <Matiere codeMatiere="GIL55">18</Matiere>
    <Matiere codeMatiere="GIL56">12</Matiere>
  </Note>
  <Note>
    <CNE>17000016</CNE>
    <LastName>GIL3_LN6</LastName>
    <FirstName>GIL3_FN6</FirstName>
    <Matiere codeMatiere="GIL51">16</Matiere>
    <Matiere codeMatiere="GIL52">13</Matiere>
    <Matiere codeMatiere="GIL53">12</Matiere>
    <Matiere codeMatiere="GIL54">10</Matiere>
    <Matiere codeMatiere="GIL55">14</Matiere>
    <Matiere codeMatiere="GIL56">12</Matiere>
  </Note>
  <Note>
    <CNE>17000017</CNE>
    <LastName>GIL3_LN7</LastName>
    <FirstName>GIL3_FN7</FirstName>
    <Matiere codeMatiere="GIL51">12</Matiere>
    <Matiere codeMatiere="GIL52">17</Matiere>
    <Matiere codeMatiere="GIL53">15</Matiere>
    <Matiere codeMatiere="GIL54">12</Matiere>
    <Matiere codeMatiere="GIL55">12</Matiere>
    <Matiere codeMatiere="GIL56">12</Matiere>
  </Note>
  <Note>
    <CNE>17000018</CNE>
    <LastName>GIL3_LN8</LastName>
    <FirstName>GIL3_FN8</FirstName>
    <Matiere codeMatiere="GIL51">12</Matiere>
    <Matiere codeMatiere="GIL52">19</Matiere>
    <Matiere codeMatiere="GIL53">13</Matiere>
    <Matiere codeMatiere="GIL54">14</Matiere>
    <Matiere codeMatiere="GIL55">15</Matiere>
    <Matiere codeMatiere="GIL56">13</Matiere>
  </Note>
  <Note>
    <CNE>17000019</CNE>
    <LastName>GIL3_LN9</LastName>
    <FirstName>GIL3_FN9</FirstName>
    <Matiere codeMatiere="GIL51">15</Matiere>
    <Matiere codeMatiere="GIL52">14</Matiere>
    <Matiere codeMatiere="GIL53">12</Matiere>
    <Matiere codeMatiere="GIL54">12</Matiere>
    <Matiere codeMatiere="GIL55">14</Matiere>
    <Matiere codeMatiere="GIL56">16</Matiere>
  </Note>
  <Note>
    <CNE>17000020</CNE>
    <LastName>GIL3_LN10</LastName>
    <FirstName>GIL3_FN10</FirstName>
    <Matiere codeMatiere="GIL51">12</Matiere>
    <Matiere codeMatiere="GIL52">12</Matiere>
    <Matiere codeMatiere="GIL53">12</Matiere>
    <Matiere codeMatiere="GIL54">13</Matiere>
    <Matiere codeMatiere="GIL55">18</Matiere>
    <Matiere codeMatiere="GIL56">13</Matiere>
  </Note>
</Notes>
