<?xml version="1.0"?>
<!DOCTYPE Notes SYSTEM "C://xampp/htdocs/GestionScolarite-XML/Validation_xml/Notes.dtd">
<Notes>
  <Note>
    <CNE>18000011</CNE>
    <LastName>GIL2_LN1</LastName>
    <FirstName>GIL2_FN1</FirstName>
    <Matiere codeMatiere="GIL31">12</Matiere>
    <Matiere codeMatiere="GIL32">6.89</Matiere>
    <Matiere codeMatiere="GIL33">19</Matiere>
    <Matiere codeMatiere="GIL34">4.7</Matiere>
    <Matiere codeMatiere="GIL35">12</Matiere>
    <Matiere codeMatiere="GIL36">13</Matiere>
    <Matiere codeMatiere="GIL37">19.32</Matiere>
    <Matiere codeMatiere="GIL38">4.98</Matiere>
    <Matiere codeMatiere="GIL39">12.09</Matiere>
  </Note>
  <Note>
    <CNE>18000012</CNE>
    <LastName>GIL2_LN2</LastName>
    <FirstName>GIL2_FN2</FirstName>
    <Matiere codeMatiere="GIL31">6.8</Matiere>
    <Matiere codeMatiere="GIL32">10.8</Matiere>
    <Matiere codeMatiere="GIL33">17</Matiere>
    <Matiere codeMatiere="GIL34">12.6</Matiere>
    <Matiere codeMatiere="GIL35">15</Matiere>
    <Matiere codeMatiere="GIL36">14</Matiere>
    <Matiere codeMatiere="GIL37">19.65</Matiere>
    <Matiere codeMatiere="GIL38">12</Matiere>
    <Matiere codeMatiere="GIL39">12</Matiere>
  </Note>
  <Note>
    <CNE>18000013</CNE>
    <LastName>GIL2_LN3</LastName>
    <FirstName>GIL2_FN3</FirstName>
    <Matiere codeMatiere="GIL31">15</Matiere>
    <Matiere codeMatiere="GIL32">12</Matiere>
    <Matiere codeMatiere="GIL33">16</Matiere>
    <Matiere codeMatiere="GIL34">13.8</Matiere>
    <Matiere codeMatiere="GIL35">19</Matiere>
    <Matiere codeMatiere="GIL36">15</Matiere>
    <Matiere codeMatiere="GIL37">12</Matiere>
    <Matiere codeMatiere="GIL38">13</Matiere>
    <Matiere codeMatiere="GIL39">12</Matiere>
  </Note>
  <Note>
    <CNE>18000014</CNE>
    <LastName>GIL2_LN4</LastName>
    <FirstName>GIL2_FN4</FirstName>
    <Matiere codeMatiere="GIL31">11</Matiere>
    <Matiere codeMatiere="GIL32">17</Matiere>
    <Matiere codeMatiere="GIL33">15</Matiere>
    <Matiere codeMatiere="GIL34">15</Matiere>
    <Matiere codeMatiere="GIL35">4.5</Matiere>
    <Matiere codeMatiere="GIL36">6</Matiere>
    <Matiere codeMatiere="GIL37">14</Matiere>
    <Matiere codeMatiere="GIL38">10</Matiere>
    <Matiere codeMatiere="GIL39">14</Matiere>
  </Note>
  <Note>
    <CNE>18000015</CNE>
    <LastName>GIL2_LN5</LastName>
    <FirstName>GIL2_FN5</FirstName>
    <Matiere codeMatiere="GIL31">10</Matiere>
    <Matiere codeMatiere="GIL32">10</Matiere>
    <Matiere codeMatiere="GIL33">10</Matiere>
    <Matiere codeMatiere="GIL34">16.8</Matiere>
    <Matiere codeMatiere="GIL35">10.54</Matiere>
    <Matiere codeMatiere="GIL36">8.9</Matiere>
    <Matiere codeMatiere="GIL37">17</Matiere>
    <Matiere codeMatiere="GIL38">14</Matiere>
    <Matiere codeMatiere="GIL39">19</Matiere>
  </Note>
  <Note>
    <CNE>18000016</CNE>
    <LastName>GIL2_LN6</LastName>
    <FirstName>GIL2_FN6</FirstName>
    <Matiere codeMatiere="GIL31">19</Matiere>
    <Matiere codeMatiere="GIL32">19</Matiere>
    <Matiere codeMatiere="GIL33">14</Matiere>
    <Matiere codeMatiere="GIL34">12</Matiere>
    <Matiere codeMatiere="GIL35">13</Matiere>
    <Matiere codeMatiere="GIL36">12</Matiere>
    <Matiere codeMatiere="GIL37">19</Matiere>
    <Matiere codeMatiere="GIL38">15.7</Matiere>
    <Matiere codeMatiere="GIL39">13</Matiere>
  </Note>
  <Note>
    <CNE>18000017</CNE>
    <LastName>GIL2_LN7</LastName>
    <FirstName>GIL2_FN7</FirstName>
    <Matiere codeMatiere="GIL31">14</Matiere>
    <Matiere codeMatiere="GIL32">18</Matiere>
    <Matiere codeMatiere="GIL33">12</Matiere>
    <Matiere codeMatiere="GIL34">10.54</Matiere>
    <Matiere codeMatiere="GIL35">19</Matiere>
    <Matiere codeMatiere="GIL36">10</Matiere>
    <Matiere codeMatiere="GIL37">15</Matiere>
    <Matiere codeMatiere="GIL38">15</Matiere>
    <Matiere codeMatiere="GIL39">10.65</Matiere>
  </Note>
  <Note>
    <CNE>18000018</CNE>
    <LastName>GIL2_LN8</LastName>
    <FirstName>GIL2_FN8</FirstName>
    <Matiere codeMatiere="GIL31">10.54</Matiere>
    <Matiere codeMatiere="GIL32">13</Matiere>
    <Matiere codeMatiere="GIL33">16</Matiere>
    <Matiere codeMatiere="GIL34">12</Matiere>
    <Matiere codeMatiere="GIL35">15</Matiere>
    <Matiere codeMatiere="GIL36">14.63</Matiere>
    <Matiere codeMatiere="GIL37">14</Matiere>
    <Matiere codeMatiere="GIL38">15.92</Matiere>
    <Matiere codeMatiere="GIL39">13</Matiere>
  </Note>
  <Note>
    <CNE>18000019</CNE>
    <LastName>GIL2_LN9</LastName>
    <FirstName>GIL2_FN9</FirstName>
    <Matiere codeMatiere="GIL31">10</Matiere>
    <Matiere codeMatiere="GIL32">13</Matiere>
    <Matiere codeMatiere="GIL33">20</Matiere>
    <Matiere codeMatiere="GIL34">15.76</Matiere>
    <Matiere codeMatiere="GIL35">14</Matiere>
    <Matiere codeMatiere="GIL36">14.02</Matiere>
    <Matiere codeMatiere="GIL37">12</Matiere>
    <Matiere codeMatiere="GIL38">16.32</Matiere>
    <Matiere codeMatiere="GIL39">16</Matiere>
  </Note>
  <Note>
    <CNE>18000020</CNE>
    <LastName>GIL2_LN10</LastName>
    <FirstName>GIL2_FN10</FirstName>
    <Matiere codeMatiere="GIL31">11.85</Matiere>
    <Matiere codeMatiere="GIL32">10</Matiere>
    <Matiere codeMatiere="GIL33">12</Matiere>
    <Matiere codeMatiere="GIL34">9.7</Matiere>
    <Matiere codeMatiere="GIL35">10</Matiere>
    <Matiere codeMatiere="GIL36">17.68</Matiere>
    <Matiere codeMatiere="GIL37">10</Matiere>
    <Matiere codeMatiere="GIL38">8.45</Matiere>
    <Matiere codeMatiere="GIL39">10.74</Matiere>
  </Note>
</Notes>
