<?xml version="1.0"?>
<!DOCTYPE Notes SYSTEM "C://xampp/htdocs/GestionScolarite-XML/Validation_xml//notes.dtd">
<Notes>
  <Note>
    <CNE>19000011</CNE>
    <LastName>GIL1_FN1</LastName>
    <FirstName>GIL1_LN1</FirstName>
    <Matiere codeMatiere="GIL11">16</Matiere>
    <Matiere codeMatiere="GIL12">10.87</Matiere>
    <Matiere codeMatiere="GIL13">14</Matiere>
    <Matiere codeMatiere="GIL14">12</Matiere>
    <Matiere codeMatiere="GIL15">17</Matiere>
    <Matiere codeMatiere="GIL16">11.98</Matiere>
    <Matiere codeMatiere="GIL17">19.32</Matiere>
    <Matiere codeMatiere="GIL18">9.98</Matiere>
    <Matiere codeMatiere="GIL19">12.09</Matiere>
  </Note>
  <Note>
    <CNE>19000012</CNE>
    <LastName>GIL1_FN2</LastName>
    <FirstName>GIL1_LN2</FirstName>
    <Matiere codeMatiere="GIL11">14</Matiere>
    <Matiere codeMatiere="GIL12">12</Matiere>
    <Matiere codeMatiere="GIL13">13</Matiere>
    <Matiere codeMatiere="GIL14">13</Matiere>
    <Matiere codeMatiere="GIL15">12</Matiere>
    <Matiere codeMatiere="GIL16">18</Matiere>
    <Matiere codeMatiere="GIL17">19.65</Matiere>
    <Matiere codeMatiere="GIL18">11.97</Matiere>
    <Matiere codeMatiere="GIL19">12</Matiere>
  </Note>
  <Note>
    <CNE>19000013</CNE>
    <LastName>GIL1_FN3</LastName>
    <FirstName>GIL1_LN3</FirstName>
    <Matiere codeMatiere="GIL11">11</Matiere>
    <Matiere codeMatiere="GIL12">13.78</Matiere>
    <Matiere codeMatiere="GIL13">16.54</Matiere>
    <Matiere codeMatiere="GIL14">12.98</Matiere>
    <Matiere codeMatiere="GIL15">14.87</Matiere>
    <Matiere codeMatiere="GIL16">16</Matiere>
    <Matiere codeMatiere="GIL17">12.39</Matiere>
    <Matiere codeMatiere="GIL18">12</Matiere>
    <Matiere codeMatiere="GIL19">17</Matiere>
  </Note>
  <Note>
    <CNE>19000014</CNE>
    <LastName>GIL1_FN4</LastName>
    <FirstName>GIL1_LN4</FirstName>
    <Matiere codeMatiere="GIL11">11.87</Matiere>
    <Matiere codeMatiere="GIL12">12</Matiere>
    <Matiere codeMatiere="GIL13">13</Matiere>
    <Matiere codeMatiere="GIL14">13.45</Matiere>
    <Matiere codeMatiere="GIL15">14</Matiere>
    <Matiere codeMatiere="GIL16">14.98</Matiere>
    <Matiere codeMatiere="GIL17">13.09</Matiere>
    <Matiere codeMatiere="GIL18">13.98</Matiere>
    <Matiere codeMatiere="GIL19">18</Matiere>
  </Note>
  <Note>
    <CNE>19000015</CNE>
    <LastName>GIL1_FN5</LastName>
    <FirstName>GIL1_LN5</FirstName>
    <Matiere codeMatiere="GIL11">14</Matiere>
    <Matiere codeMatiere="GIL12">15.9</Matiere>
    <Matiere codeMatiere="GIL13">12</Matiere>
    <Matiere codeMatiere="GIL14">15.09</Matiere>
    <Matiere codeMatiere="GIL15">12</Matiere>
    <Matiere codeMatiere="GIL16">13.87</Matiere>
    <Matiere codeMatiere="GIL17">17.88</Matiere>
    <Matiere codeMatiere="GIL18">12</Matiere>
    <Matiere codeMatiere="GIL19">12</Matiere>
  </Note>
  <Note>
    <CNE>19000016</CNE>
    <LastName>GIL1_FN6</LastName>
    <FirstName>GIL1_LN6</FirstName>
    <Matiere codeMatiere="GIL11">15</Matiere>
    <Matiere codeMatiere="GIL12">11.87</Matiere>
    <Matiere codeMatiere="GIL13">12</Matiere>
    <Matiere codeMatiere="GIL14">10.87</Matiere>
    <Matiere codeMatiere="GIL15">13</Matiere>
    <Matiere codeMatiere="GIL16">12</Matiere>
    <Matiere codeMatiere="GIL17">12.09</Matiere>
    <Matiere codeMatiere="GIL18">14.98</Matiere>
    <Matiere codeMatiere="GIL19">14.98</Matiere>
  </Note>
  <Note>
    <CNE>19000017</CNE>
    <LastName>GIL1_FN7</LastName>
    <FirstName>GIL1_LN7</FirstName>
    <Matiere codeMatiere="GIL11">12</Matiere>
    <Matiere codeMatiere="GIL12">13</Matiere>
    <Matiere codeMatiere="GIL13">15</Matiere>
    <Matiere codeMatiere="GIL14">10</Matiere>
    <Matiere codeMatiere="GIL15">17</Matiere>
    <Matiere codeMatiere="GIL16">12</Matiere>
    <Matiere codeMatiere="GIL17">13.98</Matiere>
    <Matiere codeMatiere="GIL18">16</Matiere>
    <Matiere codeMatiere="GIL19">16</Matiere>
  </Note>
  <Note>
    <CNE>19000018</CNE>
    <LastName>GIL1_FN8</LastName>
    <FirstName>GIL1_LN8</FirstName>
    <Matiere codeMatiere="GIL11">12</Matiere>
    <Matiere codeMatiere="GIL12">12.65</Matiere>
    <Matiere codeMatiere="GIL13">11</Matiere>
    <Matiere codeMatiere="GIL14">12</Matiere>
    <Matiere codeMatiere="GIL15">14</Matiere>
    <Matiere codeMatiere="GIL16">14.63</Matiere>
    <Matiere codeMatiere="GIL17">15.87</Matiere>
    <Matiere codeMatiere="GIL18">15.92</Matiere>
    <Matiere codeMatiere="GIL19">11.98</Matiere>
  </Note>
  <Note>
    <CNE>19000019</CNE>
    <LastName>GIL1_FN9</LastName>
    <FirstName>GIL1_LN9</FirstName>
    <Matiere codeMatiere="GIL11">12</Matiere>
    <Matiere codeMatiere="GIL12">13</Matiere>
    <Matiere codeMatiere="GIL13">14</Matiere>
    <Matiere codeMatiere="GIL14">15</Matiere>
    <Matiere codeMatiere="GIL15">12</Matiere>
    <Matiere codeMatiere="GIL16">14.02</Matiere>
    <Matiere codeMatiere="GIL17">16.98</Matiere>
    <Matiere codeMatiere="GIL18">16.32</Matiere>
    <Matiere codeMatiere="GIL19">12</Matiere>
  </Note>
  <Note>
    <CNE>19000020</CNE>
    <LastName>GIL1_FN10</LastName>
    <FirstName>GIL1_LN10</FirstName>
    <Matiere codeMatiere="GIL11">12</Matiere>
    <Matiere codeMatiere="GIL12">12</Matiere>
    <Matiere codeMatiere="GIL13">12.98</Matiere>
    <Matiere codeMatiere="GIL14">12</Matiere>
    <Matiere codeMatiere="GIL15">15.98</Matiere>
    <Matiere codeMatiere="GIL16">17.68</Matiere>
    <Matiere codeMatiere="GIL17">14.09</Matiere>
    <Matiere codeMatiere="GIL18">11.98</Matiere>
    <Matiere codeMatiere="GIL19">12</Matiere>
  </Note>
</Notes>
